source,title,url,date,author,platform,tone,region
zakon.kz,Government approves regional transport update,http://zakon.kz/news/transport-update-1,2026-05-02 11:00,Reporter Desk,SMI,neutral,National
zakon.kz,Public service delivery roadmap updated,http://zakon.kz/news/public-services-2,2026-05-02 10:00,Reporter Desk,SMI,neutral,National
zakon.kz,Duplicate public service delivery roadmap updated,http://zakon.kz/news/public-services-2,2026-05-02 10:00,Reporter Desk,SMI,neutral,National
zakon.kz,Regional transport plan approved,http://zakon.kz/news/transport-update-1,2026-05-02 11:00,Reporter Desk,SMI,neutral,National
lada.kz,Port activity overview for Aktau,https://www.lada.kz/aktau-news/port-activity,2026-05-02 09:15,Lada Editorial,SMI,neutral,Mangystau
